{
  "pack_id": "mj-idd-002",
  "repository": "korczis/prismatic-majordomus",
  "baseline_sha": "UNVERIFIED",
  "mission": "ui",
  "status": "blocked",
  "changed_contracts": [],
  "checks": [
    {
      "name": "source audit",
      "status": "blocked",
      "evidence": "Run inside repository to collect real SHA and file references"
    }
  ],
  "risks": [
    "This is a template, not implementation evidence"
  ],
  "next_action": "Run preflight in repository and replace placeholders"
}
